sen, cat, 0, 1start safed in int_5, variable, int_5, startstart safed in str, variable, str, startstart safed in var, variable, var, startstart realized in x, variable, x, startstart realized in wrferer, variable, wrferer, startstart realized in banana, variable, banana, startstart realized in start, variable, start, startstart realized in time, variable, time, startstart realized in num, variable, num, startstart realized in var4, variable, var4, startstart realized in size, variable, size, startstart realized in i, variable, i, startstart realized in j, variable, j, startstart realized in a, variable, a, startstart realized in weather_london, variable, weather_london, startstart realized in int_5, variable, int_5, startstart realized in str, variable, str, startstart realized in var, variable, var, startend placed in x, variable, x, endend placed in wrferer, variable, wrferer, endend placed in banana, variable, banana, endend placed in start, variable, start, endend placed in time, variable, time, endend placed in num, variable, num, endend placed in var4, variable, var4, endend placed in size, variable, size, endend placed in i, variable, i, endend placed in j, variable, j, endend placed in a, variable, a, endend placed in weather_london, variable, weather_london, endend placed in int_5, variable, int_5, endend placed in str, variable, str, endend placed in var, variable, var, endend stored in x, variable, x, endend stored in wrferer, variable, wrferer, endend stored in banana, variable, banana, endend stored in start, variable, start, endend stored in time, variable, time, endend stored in num, variable, num, endend stored in var4, variable, var4, endend stored in size, variable, size, endend stored in i, variable, i, endend stored in j, variable, j, endend stored in a, variable, a, endend stored in weather_london, variable, weather_london, endend stored in int_5, variable, int_5, endend stored in str, variable, str, endend stored in var, variable, var, endend inserted in x, variable, x, endend inserted in wrferer, variable, wrferer, endend inserted in banana, variable, banana, endend inserted in start, variable, start, endend inserted in time, variable, time, endend inserted in num, variable, num, endend inserted in var4, variable, var4, endend inserted in size, variable, size, endend inserted in i, variable, i, endend inserted in j, variable, j, endend inserted in a, variable, a, endend inserted in weather_london, variable, weather_london, endend inserted in int_5, variable, int_5, endend inserted in str, variable, str, endend inserted in var, variable, var, endend deposited in x, variable, x, endend deposited in wrferer, variable, wrferer, endend deposited in banana, variable, banana, endend deposited in start, variable, start, endend deposited in time, variable, time, endend deposited in num, variable, num, endend deposited in var4, variable, var4, endend deposited in size, variable, size, endend deposited in i, variable, i, endend deposited in j, variable, j, endend deposited in a, variable, a, endend deposited in weather_london, variable, weather_london, endend deposited in int_5, variable, int_5, endend deposited in str, variable, str, endend deposited in var, variable, var, endend put in x, variable, x, endend put in wrferer, variable, wrferer, endend put in banana, variable, banana, endend put in start, variable, start, endend put in time, variable, time, endend put in num, variable, num, endend put in var4, variable, var4, endend put in size, variable, size, endend put in i, variable, i, endend put in j, variable, j, endend put in a, variable, a, endend put in weather_london, variable, weather_london, endend put in int_5, variable, int_5, endend put in str, variable, str, endend put in var, variable, var, endend safed in x, variable, x, endend safed in wrferer, variable, wrferer, endend safed in banana, variable, banana, endend safed in start, variable, start, endend safed in time, variable, time, endend safed in num, variable, num, endend safed in var4, variable, var4, endend safed in size, variable, size, endend safed in i, variable, i, endend safed in j, variable, j, endend safed in a, variable, a, endend safed in weather_london, variable, weather_london, endend safed in int_5, variable, int_5, endend safed in str, variable, str, endend safed in var, variable, var, endend realized in x, variable, x, endend realized in wrferer, variable, wrferer, endend realized in banana, variable, banana, endend realized in start, variable, start, endend realized in time, variable, time, endend realized in num, variable, num, endend realized in var4, variable, var4, endend realized in size, variable, size, endend realized in i, variable, i, endend realized in j, variable, j, endend realized in a, variable, a, endend realized in weather_london, variable, weather_london, endend realized in int_5, variable, int_5, endend realized in str, variable, str, endend realized in var, variable, var, endtime placed in x, variable, x, timetime placed in wrferer, variable, wrferer, timetime placed in banana, variable, banana, timetime placed in start, variable, start, timetime placed in time, variable, time, timetime placed in num, variable, num, timetime placed in var4, variable, var4, timetime placed in size, variable, size, timetime placed in i, variable, i, timetime placed in j, variable, j, timetime placed in a, variable, a, timetime placed in weather_london, variable, weather_london, timetime placed in int_5, variable, int_5, timetime placed in str, variable, str, timetime placed in var, variable, var, timetime stored in x, variable, x, timetime stored in wrferer, variable, wrferer, timetime stored in banana, variable, banana, timetime stored in start, variable, start, timetime stored in time, variable, time, timetime stored in num, variable, num, timetime stored in var4, variable, var4, timetime stored in size, variable, size, timetime stored in i, variable, i, timetime stored in j, variable, j, timetime stored in a, variable, a, timetime stored in weather_london, variable, weather_london, timetime stored in int_5, variable, int_5, timetime stored in str, variable, str, timetime stored in var, variable, var, timetime inserted in x, variable, x, timetime inserted in wrferer, variable, wrferer, timetime inserted in banana, variable, banana, timetime inserted in start, variable, start, timetime inserted in time, variable, time, timetime inserted in num, variable, num, timetime inserted in var4, variable, var4, timetime inserted in size, variable, size, timetime inserted in i, variable, i, timetime inserted in j, variable, j, timetime inserted in a, variable, a, timetime inserted in weather_london, variable, weather_london, timetime inserted in int_5, variable, int_5, timetime inserted in str, variable, str, timetime inserted in var, variable, var, timetime deposited in x, variable, x, timetime deposited in wrferer, variable, wrferer, timetime deposited in banana, variable, banana, timetime deposited in start, variable, start, timetime deposited in time, variable, time, timetime deposited in num, variable, num, timetime deposited in var4, variable, var4, timetime deposited in size, variable, size, timetime deposited in i, variable, i, timetime deposited in j, variable, j, timetime deposited in a, variable, a, timetime deposited in weather_london, variable, weather_london, timetime deposited in int_5, variable, int_5, timetime deposited in str, variable, str, timetime deposited in var, variable, var, timetime put in x, variable, x, timetime put in wrferer, variable, wrferer, timetime put in banana, variable, banana, timetime put in start, variable, start, timetime put in time, variable, time, timetime put in num, variable, num, timetime put in var4, variable, var4, timetime put in size, variable, size, timetime put in i, variable, i, timetime put in j, variable, j, timetime put in a, variable, a, timetime put in weather_london, variable, weather_london, timetime put in int_5, variable, int_5, timetime put in str, variable, str, timetime put in var, variable, var, timetime safed in x, variable, x, timetime safed in wrferer, variable, wrferer, timetime safed in banana, variable, banana, timetime safed in start, variable, start, timetime safed in time, variable, time, timetime safed in num, variable, num, timetime safed in var4, variable, var4, timetime safed in size, variable, size, timetime safed in i, variable, i, timetime safed in j, variable, j, timetime safed in a, variable, a, timetime safed in weather_london, variable, weather_london, timetime safed in int_5, variable, int_5, timetime safed in str, variable, str, timetime safed in var, variable, var, timetime realized in x, variable, x, timetime realized in wrferer, variable, wrferer, timetime realized in banana, variable, banana, timetime realized in start, variable, start, timetime realized in time, variable, time, timetime realized in num, variable, num, timetime realized in var4, variable, var4, timetime realized in size, variable, size, timetime realized in i, variable, i, timetime realized in j, variable, j, timetime realized in a, variable, a, timetime realized in weather_london, variable, weather_london, timetime realized in int_5, variable, int_5, timetime realized in str, variable, str, timetime realized in var, variable, var, timesize placed in x, variable, x, sizesize placed in wrferer, variable, wrferer, sizesize placed in banana, variable, banana, sizesize placed in start, variable, start, sizesize placed in time, variable, time, sizesize placed in num, variable, num, sizesize placed in var4, variable, var4, sizesize placed in size, variable, size, sizesize placed in i, variable, i, sizesize placed in j, variable, j, sizesize placed in a, variable, a, sizesize placed in weather_london, variable, weather_london, sizesize placed in int_5, variable, int_5, sizesize placed in str, variable, str, sizesize placed in var, variable, var, sizesize stored in x, variable, x, sizesize stored in wrferer, variable, wrferer, sizesize stored in banana, variable, banana, sizesize stored in start, variable, start, sizesize stored in time, variable, time, sizesize stored in num, variable, num, sizesize stored in var4, variable, var4, sizesize stored in size, variable, size, sizesize stored in i, variable, i, sizesize stored in j, variable, j, sizesize stored in a, variable, a, sizesize stored in weather_london, variable, weather_london, sizesize stored in int_5, variable, int_5, sizesize stored in str, variable, str, sizesize stored in var, variable, var, sizesize inserted in x, variable, x, sizesize inserted in wrferer, variable, wrferer, sizesize inserted in banana, variable, banana, sizesize inserted in start, variable, start, sizesize inserted in time, variable, time, sizesize inserted in num, variable, num, sizesize inserted in var4, variable, var4, sizesize inserted in size, variable, size, sizesize inserted in i, variable, i, sizesize inserted in j, variable, j, sizesize inserted in a, variable, a, sizesize inserted in weather_london, variable, weather_london, sizesize inserted in int_5, variable, int_5, sizesize inserted in str, variable, str, sizesize inserted in var, variable, var, sizesize deposited in x, variable, x, sizesize deposited in wrferer, variable, wrferer, sizesize deposited in banana, variable, banana, sizesize deposited in start, variable, start, sizesize deposited in time, variable, time, sizesize deposited in num, variable, num, sizesize deposited in var4, variable, var4, sizesize deposited in size, variable, size, sizesize deposited in i, variable, i, sizesize deposited in j, variable, j, sizesize deposited in a, variable, a, sizesize deposited in weather_london, variable, weather_london, sizesize deposited in int_5, variable, int_5, sizesize deposited in str, variable, str, sizesize deposited in var, variable, var, sizesize put in x, variable, x, sizesize put in wrferer, variable, wrferer, sizesize put in banana, variable, banana, sizesize put in start, variable, start, sizesize put in time, variable, time, sizesize put in num, variable, num, sizesize put in var4, variable, var4, sizesize put in size, variable, size, sizesize put in i, variable, i, sizesize put in j, variable, j, sizesize put in a, variable, a, sizesize put in weather_london, variable, weather_london, sizesize put in int_5, variable, int_5, sizesize put in str, variable, str, sizesize put in var, variable, var, sizesize safed in x, variable, x, sizesize safed in wrferer, variable, wrferer, sizesize safed in banana, variable, banana, sizesize safed in start, variable, start, sizesize safed in time, variable, time, sizesize safed in num, variable, num, sizesize safed in var4, variable, var4, sizesize safed in size, variable, size, sizesize safed in i, variable, i, sizesize safed in j, variable, j, sizesize safed in a, variable, a, sizesize safed in weather_london, variable, weather_london, sizesize safed in int_5, variable, int_5, sizesize safed in str, variable, str, sizesize safed in var, variable, var, sizesize realized in x, variable, x, sizesize realized in wrferer, variable, wrferer, sizesize realized in banana, variable, banana, sizesize realized in start, variable, start, sizesize realized in time, variable, time, sizesize realized in num, variable, num, sizesize realized in var4, variable, var4, sizesize realized in size, variable, size, sizesize realized in i, variable, i, sizesize realized in j, variable, j, sizesize realized in a, variable, a, sizesize realized in weather_london, variable, weather_london, sizesize realized in int_5, variable, int_5, sizesize realized in str, variable, str, sizesize realized in var, variable, var, sizea placed in x, variable, x, aa placed in wrferer, variable, wrferer, aa placed in banana, variable, banana, aa placed in start, variable, start, aa placed in time, variable, time, aa placed in num, variable, num, aa placed in var4, variable, var4, aa placed in size, variable, size, aa placed in i, variable, i, aa placed in j, variable, j, aa placed in a, variable, a, aa placed in weather_london, variable, weather_london, aa placed in int_5, variable, int_5, aa placed in str, variable, str, aa placed in var, variable, var, aa stored in x, variable, x, aa stored in wrferer, variable, wrferer, aa stored in banana, variable, banana, aa stored in start, variable, start, aa stored in time, variable, time, aa stored in num, variable, num, aa stored in var4, variable, var4, aa stored in size, variable, size, aa stored in i, variable, i, aa stored in j, variable, j, aa stored in a, variable, a, aa stored in weather_london, variable, weather_london, aa stored in int_5, variable, int_5, aa stored in str, variable, str, aa stored in var, variable, var, aa inserted in x, variable, x, aa inserted in wrferer, variable, wrferer, aa inserted in banana, variable, banana, aa inserted in start, variable, start, aa inserted in time, variable, time, aa inserted in num, variable, num, aa inserted in var4, variable, var4, aa inserted in size, variable, size, aa inserted in i, variable, i, aa inserted in j, variable, j, aa inserted in a, variable, a, aa inserted in weather_london, variable, weather_london, aa inserted in int_5, variable, int_5, aa inserted in str, variable, str, aa inserted in var, variable, var, aa deposited in x, variable, x, aa deposited in wrferer, variable, wrferer, aa deposited in banana, variable, banana, aa deposited in start, variable, start, aa deposited in time, variable, time, aa deposited in num, variable, num, aa deposited in var4, variable, var4, aa deposited in size, variable, size, aa deposited in i, variable, i, aa deposited in j, variable, j, aa deposited in a, variable, a, aa deposited in weather_london, variable, weather_london, aa deposited in int_5, variable, int_5, aa deposited in str, variable, str, aa deposited in var, variable, var, aa put in x, variable, x, aa put in wrferer, variable, wrferer, aa put in banana, variable, banana, aa put in start, variable, start, aa put in time, variable, time, aa put in num, variable, num, aa put in var4, variable, var4, aa put in size, variable, size, aa put in i, variable, i, aa put in j, variable, j, aa put in a, variable, a, aa put in weather_london, variable, weather_london, aa put in int_5, variable, int_5, aa put in str, variable, str, aa put in var, variable, var, aa safed in x, variable, x, aa safed in wrferer, variable, wrferer, aa safed in banana, variable, banana, aa safed in start, variable, start, aa safed in time, variable, time, aa safed in num, variable, num, aa safed in var4, variable, var4, aa safed in size, variable, size, aa safed in i, variable, i, aa safed in j, variable, j, aa safed in a, variable, a, aa safed in weather_london, variable, weather_london, aa safed in int_5, variable, int_5, aa safed in str, variable, str, aa safed in var, variable, var, aa realized in x, variable, x, aa realized in wrferer, variable, wrferer, aa realized in banana, variable, banana, aa realized in start, variable, start, aa realized in time, variable, time, aa realized in num, variable, num, aa realized in var4, variable, var4, aa realized in size, variable, size, aa realized in i, variable, i, aa realized in j, variable, j, aa realized in a, variable, a, aa realized in weather_london, variable, weather_london, aa realized in int_5, variable, int_5, aa realized in str, variable, str, aa realized in var, variable, var, a4 placed in x, variable, x, 44 placed in wrferer, variable, wrferer, 44 placed in banana, variable, banana, 44 placed in start, variable, start, 44 placed in time, variable, time, 44 placed in num, variable, num, 44 placed in var4, variable, var4, 44 placed in size, variable, size, 44 placed in i, variable, i, 44 placed in j, variable, j, 44 placed in a, variable, a, 44 placed in weather_london, variable, weather_london, 44 placed in int_5, variable, int_5, 44 placed in str, variable, str, 44 placed in var, variable, var, 44 stored in x, variable, x, 44 stored in wrferer, variable, wrferer, 44 stored in banana, variable, banana, 44 stored in start, variable, start, 44 stored in time, variable, time, 44 stored in num, variable, num, 44 stored in var4, variable, var4, 44 stored in size, variable, size, 44 stored in i, variable, i, 44 stored in j, variable, j, 44 stored in a, variable, a, 44 stored in weather_london, variable, weather_london, 44 stored in int_5, variable, int_5, 44 stored in str, variable, str, 44 stored in var, variable, var, 44 inserted in x, variable, x, 44 inserted in wrferer, variable, wrferer, 44 inserted in banana, variable, banana, 44 inserted in start, variable, start, 44 inserted in time, variable, time, 44 inserted in num, variable, num, 44 inserted in var4, variable, var4, 44 inserted in size, variable, size, 44 inserted in i, variable, i, 44 inserted in j, variable, j, 44 inserted in a, variable, a, 44 inserted in weather_london, variable, weather_london, 44 inserted in int_5, variable, int_5, 44 inserted in str, variable, str, 44 inserted in var, variable, var, 44 deposited in x, variable, x, 44 deposited in wrferer, variable, wrferer, 44 deposited in banana, variable, banana, 44 deposited in start, variable, start, 44 deposited in time, variable, time, 44 deposited in num, variable, num, 44 deposited in var4, variable, var4, 44 deposited in size, variable, size, 44 deposited in i, variable, i, 44 deposited in j, variable, j, 44 deposited in a, variable, a, 44 deposited in weather_london, variable, weather_london, 44 deposited in int_5, variable, int_5, 44 deposited in str, variable, str, 44 deposited in var, variable, var, 44 put in x, variable, x, 44 put in wrferer, variable, wrferer, 44 put in banana, variable, banana, 44 put in start, variable, start, 44 put in time, variable, time, 44 put in num, variable, num, 44 put in var4, variable, var4, 44 put in size, variable, size, 44 put in i, variable, i, 44 put in j, variable, j, 44 put in a, variable, a, 44 put in weather_london, variable, weather_london, 44 put in int_5, variable, int_5, 44 put in str, variable, str, 44 put in var, variable, var, 44 safed in x, variable, x, 44 safed in wrferer, variable, wrferer, 44 safed in banana, variable, banana, 44 safed in start, variable, start, 44 safed in time, variable, time, 44 safed in num, variable, num, 44 safed in var4, variable, var4, 44 safed in size, variable, size, 44 safed in i, variable, i, 44 safed in j, variable, j, 44 safed in a, variable, a, 44 safed in weather_london, variable, weather_london, 44 safed in int_5, variable, int_5, 44 safed in str, variable, str, 44 safed in var, variable, var, 44 realized in x, variable, x, 44 realized in wrferer, variable, wrferer, 44 realized in banana, variable, banana, 44 realized in start, variable, start, 44 realized in time, variable, time, 44 realized in num, variable, num, 44 realized in var4, variable, var4, 44 realized in size, variable, size, 44 realized in i, variable, i, 44 realized in j, variable, j, 44 realized in a, variable, a, 44 realized in weather_london, variable, weather_london, 44 realized in int_5, variable, int_5, 44 realized in str, variable, str, 44 realized in var, variable, var, 45 placed in x, variable, x, 55 placed in wrferer, variable, wrferer, 55 placed in banana, variable, banana, 55 placed in start, variable, start, 55 placed in time, variable, time, 55 placed in num, variable, num, 55 placed in var4, variable, var4, 55 placed in size, variable, size, 55 placed in i, variable, i, 55 placed in j, variable, j, 55 placed in a, variable, a, 55 placed in weather_london, variable, weather_london, 55 placed in int_5, variable, int_5, 55 placed in str, variable, str, 55 placed in var, variable, var, 55 stored in x, variable, x, 55 stored in wrferer, variable, wrferer, 55 stored in banana, variable, banana, 55 stored in start, variable, start, 55 stored in time, variable, time, 55 stored in num, variable, num, 55 stored in var4, variable, var4, 55 stored in size, variable, size, 55 stored in i, variable, i, 55 stored in j, variable, j, 55 stored in a, variable, a, 55 stored in weather_london, variable, weather_london, 55 stored in int_5, variable, int_5, 55 stored in str, variable, str, 55 stored in var, variable, var, 55 inserted in x, variable, x, 55 inserted in wrferer, variable, wrferer, 55 inserted in banana, variable, banana, 55 inserted in start, variable, start, 55 inserted in time, variable, time, 55 inserted in num, variable, num, 55 inserted in var4, variable, var4, 55 inserted in size, variable, size, 55 inserted in i, variable, i, 55 inserted in j, variable, j, 55 inserted in a, variable, a, 55 inserted in weather_london, variable, weather_london, 55 inserted in int_5, variable, int_5, 55 inserted in str, variable, str, 55 inserted in var, variable, var, 55 deposited in x, variable, x, 55 deposited in wrferer, variable, wrferer, 55 deposited in banana, variable, banana, 55 deposited in start, variable, start, 55 deposited in time, variable, time, 55 deposited in num, variable, num, 55 deposited in var4, variable, var4, 55 deposited in size, variable, size, 55 deposited in i, variable, i, 55 deposited in j, variable, j, 55 deposited in a, variable, a, 55 deposited in weather_london, variable, weather_london, 55 deposited in int_5, variable, int_5, 55 deposited in str, variable, str, 55 deposited in var, variable, var, 55 put in x, variable, x, 55 put in wrferer, variable, wrferer, 55 put in banana, variable, banana, 55 put in start, variable, start, 55 put in time, variable, time, 55 put in num, variable, num, 55 put in var4, variable, var4, 55 put in size, variable, size, 55 put in i, variable, i, 55 put in j, variable, j, 55 put in a, variable, a, 55 put in weather_london, variable, weather_london, 55 put in int_5, variable, int_5, 55 put in str, variable, str, 55 put in var, variable, var, 55 safed in x, variable, x, 55 safed in wrferer, variable, wrferer, 55 safed in banana, variable, banana, 55 safed in start, variable, start, 55 safed in time, variable, time, 55 safed in num, variable, num, 55 safed in var4, variable, var4, 55 safed in size, variable, size, 55 safed in i, variable, i, 55 safed in j, variable, j, 55 safed in a, variable, a, 55 safed in weather_london, variable, weather_london, 55 safed in int_5, variable, int_5, 55 safed in str, variable, str, 55 safed in var, variable, var, 55 realized in x, variable, x, 55 realized in wrferer, variable, wrferer, 55 realized in banana, variable, banana, 55 realized in start, variable, start, 55 realized in time, variable, time, 55 realized in num, variable, num, 55 realized in var4, variable, var4, 55 realized in size, variable, size, 55 realized in i, variable, i, 55 realized in j, variable, j, 55 realized in a, variable, a, 55 realized in weather_london, variable, weather_london, 55 realized in int_5, variable, int_5, 55 realized in str, variable, str, 55 realized in var, variable, var, 510 placed in x, variable, x, 1010 placed in wrferer, variable, wrferer, 1010 placed in banana, variable, banana, 1010 placed in start, variable, start, 1010 placed in time, variable, time, 1010 placed in num, variable, num, 1010 placed in var4, variable, var4, 1010 placed in size, variable, size, 1010 placed in i, variable, i, 10