sen, cat, 0, 1deposit 234234 into str, variable, str, 234234deposit 234234 into var, variable, var, 234234deposit 343423424 into x, variable, x, 343423424deposit 343423424 into wrferer, variable, wrferer, 343423424deposit 343423424 into banana, variable, banana, 343423424deposit 343423424 into start, variable, start, 343423424deposit 343423424 into time, variable, time, 343423424deposit 343423424 into num, variable, num, 343423424deposit 343423424 into var4, variable, var4, 343423424deposit 343423424 into size, variable, size, 343423424deposit 343423424 into i, variable, i, 343423424deposit 343423424 into j, variable, j, 343423424deposit 343423424 into a, variable, a, 343423424deposit 343423424 into weather_london, variable, weather_london, 343423424deposit 343423424 into int_5, variable, int_5, 343423424deposit 343423424 into str, variable, str, 343423424deposit 343423424 into var, variable, var, 343423424deposit london into x, variable, x, londondeposit london into wrferer, variable, wrferer, londondeposit london into banana, variable, banana, londondeposit london into start, variable, start, londondeposit london into time, variable, time, londondeposit london into num, variable, num, londondeposit london into var4, variable, var4, londondeposit london into size, variable, size, londondeposit london into i, variable, i, londondeposit london into j, variable, j, londondeposit london into a, variable, a, londondeposit london into weather_london, variable, weather_london, londondeposit london into int_5, variable, int_5, londondeposit london into str, variable, str, londondeposit london into var, variable, var, londondeposit opera into x, variable, x, operadeposit opera into wrferer, variable, wrferer, operadeposit opera into banana, variable, banana, operadeposit opera into start, variable, start, operadeposit opera into time, variable, time, operadeposit opera into num, variable, num, operadeposit opera into var4, variable, var4, operadeposit opera into size, variable, size, operadeposit opera into i, variable, i, operadeposit opera into j, variable, j, operadeposit opera into a, variable, a, operadeposit opera into weather_london, variable, weather_london, operadeposit opera into int_5, variable, int_5, operadeposit opera into str, variable, str, operadeposit opera into var, variable, var, operadeposit paul into x, variable, x, pauldeposit paul into wrferer, variable, wrferer, pauldeposit paul into banana, variable, banana, pauldeposit paul into start, variable, start, pauldeposit paul into time, variable, time, pauldeposit paul into num, variable, num, pauldeposit paul into var4, variable, var4, pauldeposit paul into size, variable, size, pauldeposit paul into i, variable, i, pauldeposit paul into j, variable, j, pauldeposit paul into a, variable, a, pauldeposit paul into weather_london, variable, weather_london, pauldeposit paul into int_5, variable, int_5, pauldeposit paul into str, variable, str, pauldeposit paul into var, variable, var, pauldeposit fancy into x, variable, x, fancydeposit fancy into wrferer, variable, wrferer, fancydeposit fancy into banana, variable, banana, fancydeposit fancy into start, variable, start, fancydeposit fancy into time, variable, time, fancydeposit fancy into num, variable, num, fancydeposit fancy into var4, variable, var4, fancydeposit fancy into size, variable, size, fancydeposit fancy into i, variable, i, fancydeposit fancy into j, variable, j, fancydeposit fancy into a, variable, a, fancydeposit fancy into weather_london, variable, weather_london, fancydeposit fancy into int_5, variable, int_5, fancydeposit fancy into str, variable, str, fancydeposit fancy into var, variable, var, fancydeposit 9 into x, variable, x, 9deposit 9 into wrferer, variable, wrferer, 9deposit 9 into banana, variable, banana, 9deposit 9 into start, variable, start, 9deposit 9 into time, variable, time, 9deposit 9 into num, variable, num, 9deposit 9 into var4, variable, var4, 9deposit 9 into size, variable, size, 9deposit 9 into i, variable, i, 9deposit 9 into j, variable, j, 9deposit 9 into a, variable, a, 9deposit 9 into weather_london, variable, weather_london, 9deposit 9 into int_5, variable, int_5, 9deposit 9 into str, variable, str, 9deposit 9 into var, variable, var, 9deposit 223 into x, variable, x, 223deposit 223 into wrferer, variable, wrferer, 223deposit 223 into banana, variable, banana, 223deposit 223 into start, variable, start, 223deposit 223 into time, variable, time, 223deposit 223 into num, variable, num, 223deposit 223 into var4, variable, var4, 223deposit 223 into size, variable, size, 223deposit 223 into i, variable, i, 223deposit 223 into j, variable, j, 223deposit 223 into a, variable, a, 223deposit 223 into weather_london, variable, weather_london, 223deposit 223 into int_5, variable, int_5, 223deposit 223 into str, variable, str, 223deposit 223 into var, variable, var, 223put 0 into x, variable, x, 0put 0 into wrferer, variable, wrferer, 0put 0 into banana, variable, banana, 0put 0 into start, variable, start, 0put 0 into time, variable, time, 0put 0 into num, variable, num, 0put 0 into var4, variable, var4, 0put 0 into size, variable, size, 0put 0 into i, variable, i, 0put 0 into j, variable, j, 0put 0 into a, variable, a, 0put 0 into weather_london, variable, weather_london, 0put 0 into int_5, variable, int_5, 0put 0 into str, variable, str, 0put 0 into var, variable, var, 0put x into x, variable, x, xput x into wrferer, variable, wrferer, xput x into banana, variable, banana, xput x into start, variable, start, xput x into time, variable, time, xput x into num, variable, num, xput x into var4, variable, var4, xput x into size, variable, size, xput x into i, variable, i, xput x into j, variable, j, xput x into a, variable, a, xput x into weather_london, variable, weather_london, xput x into int_5, variable, int_5, xput x into str, variable, str, xput x into var, variable, var, xput wrferer into x, variable, x, wrfererput wrferer into wrferer, variable, wrferer, wrfererput wrferer into banana, variable, banana, wrfererput wrferer into start, variable, start, wrfererput wrferer into time, variable, time, wrfererput wrferer into num, variable, num, wrfererput wrferer into var4, variable, var4, wrfererput wrferer into size, variable, size, wrfererput wrferer into i, variable, i, wrfererput wrferer into j, variable, j, wrfererput wrferer into a, variable, a, wrfererput wrferer into weather_london, variable, weather_london, wrfererput wrferer into int_5, variable, int_5, wrfererput wrferer into str, variable, str, wrfererput wrferer into var, variable, var, wrfererput banana into x, variable, x, bananaput banana into wrferer, variable, wrferer, bananaput banana into banana, variable, banana, bananaput banana into start, variable, start, bananaput banana into time, variable, time, bananaput banana into num, variable, num, bananaput banana into var4, variable, var4, bananaput banana into size, variable, size, bananaput banana into i, variable, i, bananaput banana into j, variable, j, bananaput banana into a, variable, a, bananaput banana into weather_london, variable, weather_london, bananaput banana into int_5, variable, int_5, bananaput banana into str, variable, str, bananaput banana into var, variable, var, bananaput const into x, variable, x, constput const into wrferer, variable, wrferer, constput const into banana, variable, banana, constput const into start, variable, start, constput const into time, variable, time, constput const into num, variable, num, constput const into var4, variable, var4, constput const into size, variable, size, constput const into i, variable, i, constput const into j, variable, j, constput const into a, variable, a, constput const into weather_london, variable, weather_london, constput const into int_5, variable, int_5, constput const into str, variable, str, constput const into var, variable, var, constput start into x, variable, x, startput start into wrferer, variable, wrferer, startput start into banana, variable, banana, startput start into start, variable, start, startput start into time, variable, time, startput start into num, variable, num, startput start into var4, variable, var4, startput start into size, variable, size, startput start into i, variable, i, startput start into j, variable, j, startput start into a, variable, a, startput start into weather_london, variable, weather_london, startput start into int_5, variable, int_5, startput start into str, variable, str, startput start into var, variable, var, startput end into x, variable, x, endput end into wrferer, variable, wrferer, endput end into banana, variable, banana, endput end into start, variable, start, endput end into time, variable, time, endput end into num, variable, num, endput end into var4, variable, var4, endput end into size, variable, size, endput end into i, variable, i, endput end into j, variable, j, endput end into a, variable, a, endput end into weather_london, variable, weather_london, endput end into int_5, variable, int_5, endput end into str, variable, str, endput end into var, variable, var, endput time into x, variable, x, timeput time into wrferer, variable, wrferer, timeput time into banana, variable, banana, timeput time into start, variable, start, timeput time into time, variable, time, timeput time into num, variable, num, timeput time into var4, variable, var4, timeput time into size, variable, size, timeput time into i, variable, i, timeput time into j, variable, j, timeput time into a, variable, a, timeput time into weather_london, variable, weather_london, timeput time into int_5, variable, int_5, timeput time into str, variable, str, timeput time into var, variable, var, timeput size into x, variable, x, sizeput size into wrferer, variable, wrferer, sizeput size into banana, variable, banana, sizeput size into start, variable, start, sizeput size into time, variable, time, sizeput size into num, variable, num, sizeput size into var4, variable, var4, sizeput size into size, variable, size, sizeput size into i, variable, i, sizeput size into j, variable, j, sizeput size into a, variable, a, sizeput size into weather_london, variable, weather_london, sizeput size into int_5, variable, int_5, sizeput size into str, variable, str, sizeput size into var, variable, var, sizeput a into x, variable, x, aput a into wrferer, variable, wrferer, aput a into banana, variable, banana, aput a into start, variable, start, aput a into time, variable, time, aput a into num, variable, num, aput a into var4, variable, var4, aput a into size, variable, size, aput a into i, variable, i, aput a into j, variable, j, aput a into a, variable, a, aput a into weather_london, variable, weather_london, aput a into int_5, variable, int_5, aput a into str, variable, str, aput a into var, variable, var, aput 4 into x, variable, x, 4put 4 into wrferer, variable, wrferer, 4put 4 into banana, variable, banana, 4put 4 into start, variable, start, 4put 4 into time, variable, time, 4put 4 into num, variable, num, 4put 4 into var4, variable, var4, 4put 4 into size, variable, size, 4put 4 into i, variable, i, 4put 4 into j, variable, j, 4put 4 into a, variable, a, 4put 4 into weather_london, variable, weather_london, 4put 4 into int_5, variable, int_5, 4put 4 into str, variable, str, 4put 4 into var, variable, var, 4put 5 into x, variable, x, 5put 5 into wrferer, variable, wrferer, 5put 5 into banana, variable, banana, 5put 5 into start, variable, start, 5put 5 into time, variable, time, 5put 5 into num, variable, num, 5put 5 into var4, variable, var4, 5put 5 into size, variable, size, 5put 5 into i, variable, i, 5put 5 into j, variable, j, 5put 5 into a, variable, a, 5put 5 into weather_london, variable, weather_london, 5put 5 into int_5, variable, int_5, 5put 5 into str, variable, str, 5put 5 into var, variable, var, 5put 10 into x, variable, x, 10put 10 into wrferer, variable, wrferer, 10put 10 into banana, variable, banana, 10put 10 into start, variable, start, 10put 10 into time, variable, time, 10put 10 into num, variable, num, 10put 10 into var4, variable, var4, 10put 10 into size, variable, size, 10put 10 into i, variable, i, 10put 10 into j, variable, j, 10put 10 into a, variable, a, 10put 10 into weather_london, variable, weather_london, 10put 10 into int_5, variable, int_5, 10put 10 into str, variable, str, 10put 10 into var, variable, var, 10put 234234 into x, variable, x, 234234put 234234 into wrferer, variable, wrferer, 234234put 234234 into banana, variable, banana, 234234put 234234 into start, variable, start, 234234put 234234 into time, variable, time, 234234put 234234 into num, variable, num, 234234put 234234 into var4, variable, var4, 234234put 234234 into size, variable, size, 234234put 234234 into i, variable, i, 234234put 234234 into j, variable, j, 234234put 234234 into a, variable, a, 234234put 234234 into weather_london, variable, weather_london, 234234put 234234 into int_5, variable, int_5, 234234put 234234 into str, variable, str, 234234put 234234 into var, variable, var, 234234put 343423424 into x, variable, x, 343423424put 343423424 into wrferer, variable, wrferer, 343423424put 343423424 into banana, variable, banana, 343423424put 343423424 into start, variable, start, 343423424put 343423424 into time, variable, time, 343423424put 343423424 into num, variable, num, 343423424put 343423424 into var4, variable, var4, 343423424put 343423424 into size, variable, size, 343423424put 343423424 into i, variable, i, 343423424put 343423424 into j, variable, j, 343423424put 343423424 into a, variable, a, 343423424put 343423424 into weather_london, variable, weather_london, 343423424put 343423424 into int_5, variable, int_5, 343423424put 343423424 into str, variable, str, 343423424put 343423424 into var, variable, var, 343423424put london into x, variable, x, londonput london into wrferer, variable, wrferer, londonput london into banana, variable, banana, londonput london into start, variable, start, londonput london into time, variable, time, londonput london into num, variable, num, londonput london into var4, variable, var4, londonput london into size, variable, size, londonput london into i, variable, i, londonput london into j, variable, j, londonput london into a, variable, a, londonput london into weather_london, variable, weather_london, londonput london into int_5, variable, int_5, londonput london into str, variable, str, londonput london into var, variable, var, londonput opera into x, variable, x, operaput opera into wrferer, variable, wrferer, operaput opera into banana, variable, banana, operaput opera into start, variable, start, operaput opera into time, variable, time, operaput opera into num, variable, num, operaput opera into var4, variable, var4, operaput opera into size, variable, size, operaput opera into i, variable, i, operaput opera into j, variable, j, operaput opera into a, variable, a, operaput opera into weather_london, variable, weather_london, operaput opera into int_5, variable, int_5, operaput opera into str, variable, str, operaput opera into var, variable, var, operaput paul into x, variable, x, paulput paul into wrferer, variable, wrferer, paulput paul into banana, variable, banana, paulput paul into start, variable, start, paulput paul into time, variable, time, paulput paul into num, variable, num, paulput paul into var4, variable, var4, paulput paul into size, variable, size, paulput paul into i, variable, i, paulput paul into j, variable, j, paulput paul into a, variable, a, paulput paul into weather_london, variable, weather_london, paulput paul into int_5, variable, int_5, paulput paul into str, variable, str, paulput paul into var, variable, var, paulput fancy into x, variable, x, fancyput fancy into wrferer, variable, wrferer, fancyput fancy into banana, variable, banana, fancyput fancy into start, variable, start, fancyput fancy into time, variable, time, fancyput fancy into num, variable, num, fancyput fancy into var4, variable, var4, fancyput fancy into size, variable, size, fancyput fancy into i, variable, i, fancyput fancy into j, variable, j, fancyput fancy into a, variable, a, fancyput fancy into weather_london, variable, weather_london, fancyput fancy into int_5, variable, int_5, fancyput fancy into str, variable, str, fancyput fancy into var, variable, var, fancyput 9 into x, variable, x, 9put 9 into wrferer, variable, wrferer, 9put 9 into banana, variable, banana, 9put 9 into start, variable, start, 9put 9 into time, variable, time, 9put 9 into num, variable, num, 9put 9 into var4, variable, var4, 9put 9 into size, variable, size, 9put 9 into i, variable, i, 9put 9 into j, variable, j, 9put 9 into a, variable, a, 9put 9 into weather_london, variable, weather_london, 9put 9 into int_5, variable, int_5, 9put 9 into str, variable, str, 9put 9 into var, variable, var, 9put 223 into x, variable, x, 223put 223 into wrferer, variable, wrferer, 223put 223 into banana, variable, banana, 223put 223 into start, variable, start, 223put 223 into time, variable, time, 223put 223 into num, variable, num, 223put 223 into var4, variable, var4, 223put 223 into size, variable, size, 223put 223 into i, variable, i, 223put 223 into j, variable, j, 223put 223 into a, variable, a, 223put 223 into weather_london, variable, weather_london, 223put 223 into int_5, variable, int_5, 223put 223 into str, variable, str, 223put 223 into var, variable, var, 223place 0 in x, variable, x, 0place 0 in wrferer, variable, wrferer, 0place 0 in banana, variable, banana, 0place 0 in start, variable, start, 0place 0 in time, variable, time, 0place 0 in num, variable, num, 0place 0 in var4, variable, var4, 0place 0 in size, variable, size, 0place 0 in i, variable, i, 0place 0 in j, variable, j, 0place 0 in a, variable, a, 0place 0 in weather_london, variable, weather_london, 0place 0 in int_5, variable, int_5, 0place 0 in str, variable, str, 0place 0 in var, variable, var, 0place x in x, variable, x, xplace x in wrferer, variable, wrferer, xplace x in banana, variable, banana, xplace x in start, variable, start, xplace x in time, variable, time, xplace x in num, variable, num, xplace x in var4, variable, var4, xplace x in size, variable, size, xplace x in i, variable, i, xplace x in j, variable, j, xplace x in a, variable, a, xplace x in weather_london, variable, weather_london, xplace x in int_5, variable, int_5, xplace x in str, variable, str, xplace x in var, variable, var, xplace wrferer in x, variable, x, wrfererplace wrferer in wrferer, variable, wrferer, wrfererplace wrferer in banana, variable, banana, wrfererplace wrferer in start, variable, start, wrfererplace wrferer in time, variable, time, wrfererplace wrferer in num, variable, num, wrfererplace wrferer in var4, variable, var4, wrfererplace wrferer in size, variable, size, wrfererplace wrferer in i, variable, i, wrfererplace wrferer in j, variable, j, wrfererplace wrferer in a, variable, a, wrfererplace wrferer in weather_london, variable, weather_london, wrfererplace wrferer in int_5, variable, int_5, wrfererplace wrferer in str, variable, str, wrfererplace wrferer in var, variable, var, wrfererplace banana in x, variable, x, bananaplace banana in wrferer, variable, wrferer, bananaplace banana in banana, variable, banana, bananaplace banana in start, variable, start, bananaplace banana in time, variable, time, bananaplace banana in num, variable, num, bananaplace banana in var4, variable, var4, bananaplace banana in size, variable, size, bananaplace banana in i, variable, i, bananaplace banana in j, variable, j, bananaplace banana in a, variable, a, bananaplace banana in weather_london, variable, weather_london, bananaplace banana in int_5, variable, int_5, bananaplace banana in str, variable, str, bananaplace banana in var, variable, var, bananaplace const in x, variable, x, constplace const in wrferer, variable, wrferer, constplace const in banana, variable, banana, constplace const in start, variable, start, constplace const in time, variable, time, constplace const in num, variable, num, constplace const in var4, variable, var4, constplace const in size, variable, size, constplace const in i, variable, i, constplace const in j, variable, j, constplace const in a, variable, a, constplace const in weather_london, variable, weather_london, constplace const in int_5, variable, int_5, constplace const in str, variable, str, constplace const in var, variable, var, constplace start in x, variable, x, startplace start in wrferer, variable, wrferer, startplace start in banana, variable, banana, startplace start in start, variable, start, startplace start in time, variable, time, startplace start in num, variable, num, startplace start in var4, variable, var4, startplace start in size, variable, size, startplace start in i, variable, i, startplace start in j, variable, j, startplace start in a, variable, a, startplace start in weather_london, variable, weather_london, startplace start in int_5, variable, int_5, startplace start in str, variable, str, startplace start in var, variable, var, startplace end in x, variable, x, endplace end in wrferer, variable, wrferer, endplace end in banana, variable, banana, endplace end in start, variable, start, endplace end in time, variable, time, endplace end in num, variable, num, endplace end in var4, variable, var4, endplace end in size, variable, size, endplace end in i, variable, i, endplace end in j, variable, j, endplace end in a, variable, a, endplace end in weather_london, variable, weather_london, endplace end in int_5, variable, int_5, endplace end in str, variable, str, endplace end in var, variable, var, endplace time in x, variable, x, timeplace time in wrferer, variable, wrferer, timeplace time in banana, variable, banana, timeplace time in start, variable, start, timeplace time in time, variable, time, timeplace time in num, variable, num, timeplace time in var4, variable, var4, timeplace time in size, variable, size, timeplace time in i, variable, i, timeplace time in j, variable, j, timeplace time in a, variable, a, timeplace time in weather_london, variable, weather_london, timeplace time in int_5, variable, int_5, timeplace time in str, variable, str, timeplace time in var, variable, var, timeplace size in x, variable, x, sizeplace size in wrferer, variable, wrferer, sizeplace size in banana, variable, banana, sizeplace size in start, variable, start, sizeplace size in time, variable, time, sizeplace size in num, variable, num, sizeplace size in var4, variable, var4, sizeplace size in size, variable, size, sizeplace size in i, variable, i, sizeplace size in j, variable, j, sizeplace size in a, variable, a, sizeplace size in weather_london, variable, weather_london, sizeplace size in int_5, variable, int_5, sizeplace size in str, variable, str, sizeplace size in var, variable, var, sizeplace a in x, variable, x, aplace a in wrferer, variable, wrferer, aplace a in banana, variable, banana, aplace a in start, variable, start, aplace a in time, variable, time, aplace a in num, variable, num, aplace a in var4, variable, var4, aplace a in size, variable, size, aplace a in i, variable, i, aplace a in j, variable, j, aplace a in a, variable, a, aplace a in weather_london, variable, weather_london, aplace a in int_5, variable, int_5, aplace a in str, variable, str, aplace a in var, variable, var, aplace 4 in x, variable, x, 4place 4 in wrferer, variable, wrferer, 4place 4 in banana, variable, banana, 4place 4 in start, variable, start, 4place 4 in time, variable, time, 4place 4 in num, variable, num, 4place 4 in var4, variable, var4, 4place 4 in size, variable, size, 4place 4 in i, variable, i, 4place 4 in j, variable, j, 4place 4 in a, variable, a, 4place 4 in weather_london, variable, weather_london, 4place 4 in int_5, variable, int_5, 4place 4 in str, variable, str, 4place 4 in var, variable, var, 4place 5 in x, variable, x, 5place 5 in wrferer, variable, wrferer, 5place 5 in banana, variable, banana, 5place 5 in start, variable, start, 5place 5 in time, variable, time, 5place 5 in num, variable, num, 5place 5 in var4, variable, var4, 5place 5 in size, variable, size, 5place 5 in i, variable, i, 5place 5 in j, variable, j, 5place 5 in a, variable, a, 5place 5 in weather_london, variable, weather_london, 5place 5 in int_5, variable, int_5, 5place 5 in str, variable, str, 5place 5 in var, variable, var, 5place 10 in x, variable, x, 10place 10 in wrferer, variable, wrferer, 10place 10 in banana, variable, banana, 10place 10 in start, variable, start, 10place 10 in time, variable, time, 10place 10 in num, variable, num, 10place 10 in var4, variable, var4, 10place 10 in size, variable, size, 10place 10 in i, variable, i, 10place 10 in j, variable, j, 10place 10 in a, variable, a, 10place 10 in weather_london, variable, weather_london, 10place 10 in int_5, variable, int_5, 10place 10 in str, variable, str, 10place 10 in var, variable, var, 10place 234234 in x, variable, x, 234234place 234234 in wrferer, variable, wrferer, 234234place 234234 in banana, variable, banana, 234234place 234234 in start, variable, start, 234234place 234234 in time, variable, time, 234234place 234234 in num, variable, num, 234234place 234234 in var4, variable, var4, 234234place 234234 in size, variable, size, 234234