sen, cat, 0, 1point x to 0, variable, x, 0point x to x, variable, x, xpoint x to wrferer, variable, x, wrfererpoint x to banana, variable, x, bananapoint x to const, variable, x, constpoint x to start, variable, x, startpoint x to end, variable, x, endpoint x to time, variable, x, timepoint x to size, variable, x, sizepoint x to a, variable, x, apoint x to 4, variable, x, 4point x to 5, variable, x, 5point x to 10, variable, x, 10point x to 234234, variable, x, 234234point x to 343423424, variable, x, 343423424point x to london, variable, x, londonpoint x to opera, variable, x, operapoint x to paul, variable, x, paulpoint x to fancy, variable, x, fancypoint x to 9, variable, x, 9point x to 223, variable, x, 223point wrferer to 0, variable, wrferer, 0point wrferer to x, variable, wrferer, xpoint wrferer to wrferer, variable, wrferer, wrfererpoint wrferer to banana, variable, wrferer, bananapoint wrferer to const, variable, wrferer, constpoint wrferer to start, variable, wrferer, startpoint wrferer to end, variable, wrferer, endpoint wrferer to time, variable, wrferer, timepoint wrferer to size, variable, wrferer, sizepoint wrferer to a, variable, wrferer, apoint wrferer to 4, variable, wrferer, 4point wrferer to 5, variable, wrferer, 5point wrferer to 10, variable, wrferer, 10point wrferer to 234234, variable, wrferer, 234234point wrferer to 343423424, variable, wrferer, 343423424point wrferer to london, variable, wrferer, londonpoint wrferer to opera, variable, wrferer, operapoint wrferer to paul, variable, wrferer, paulpoint wrferer to fancy, variable, wrferer, fancypoint wrferer to 9, variable, wrferer, 9point wrferer to 223, variable, wrferer, 223point banana to 0, variable, banana, 0point banana to x, variable, banana, xpoint banana to wrferer, variable, banana, wrfererpoint banana to banana, variable, banana, bananapoint banana to const, variable, banana, constpoint banana to start, variable, banana, startpoint banana to end, variable, banana, endpoint banana to time, variable, banana, timepoint banana to size, variable, banana, sizepoint banana to a, variable, banana, apoint banana to 4, variable, banana, 4point banana to 5, variable, banana, 5point banana to 10, variable, banana, 10point banana to 234234, variable, banana, 234234point banana to 343423424, variable, banana, 343423424point banana to london, variable, banana, londonpoint banana to opera, variable, banana, operapoint banana to paul, variable, banana, paulpoint banana to fancy, variable, banana, fancypoint banana to 9, variable, banana, 9point banana to 223, variable, banana, 223point start to 0, variable, start, 0point start to x, variable, start, xpoint start to wrferer, variable, start, wrfererpoint start to banana, variable, start, bananapoint start to const, variable, start, constpoint start to start, variable, start, startpoint start to end, variable, start, endpoint start to time, variable, start, timepoint start to size, variable, start, sizepoint start to a, variable, start, apoint start to 4, variable, start, 4point start to 5, variable, start, 5point start to 10, variable, start, 10point start to 234234, variable, start, 234234point start to 343423424, variable, start, 343423424point start to london, variable, start, londonpoint start to opera, variable, start, operapoint start to paul, variable, start, paulpoint start to fancy, variable, start, fancypoint start to 9, variable, start, 9point start to 223, variable, start, 223point time to 0, variable, time, 0point time to x, variable, time, xpoint time to wrferer, variable, time, wrfererpoint time to banana, variable, time, bananapoint time to const, variable, time, constpoint time to start, variable, time, startpoint time to end, variable, time, endpoint time to time, variable, time, timepoint time to size, variable, time, sizepoint time to a, variable, time, apoint time to 4, variable, time, 4point time to 5, variable, time, 5point time to 10, variable, time, 10point time to 234234, variable, time, 234234point time to 343423424, variable, time, 343423424point time to london, variable, time, londonpoint time to opera, variable, time, operapoint time to paul, variable, time, paulpoint time to fancy, variable, time, fancypoint time to 9, variable, time, 9point time to 223, variable, time, 223point num to 0, variable, num, 0point num to x, variable, num, xpoint num to wrferer, variable, num, wrfererpoint num to banana, variable, num, bananapoint num to const, variable, num, constpoint num to start, variable, num, startpoint num to end, variable, num, endpoint num to time, variable, num, timepoint num to size, variable, num, sizepoint num to a, variable, num, apoint num to 4, variable, num, 4point num to 5, variable, num, 5point num to 10, variable, num, 10point num to 234234, variable, num, 234234point num to 343423424, variable, num, 343423424point num to london, variable, num, londonpoint num to opera, variable, num, operapoint num to paul, variable, num, paulpoint num to fancy, variable, num, fancypoint num to 9, variable, num, 9point num to 223, variable, num, 223point var4 to 0, variable, var4, 0point var4 to x, variable, var4, xpoint var4 to wrferer, variable, var4, wrfererpoint var4 to banana, variable, var4, bananapoint var4 to const, variable, var4, constpoint var4 to start, variable, var4, startpoint var4 to end, variable, var4, endpoint var4 to time, variable, var4, timepoint var4 to size, variable, var4, sizepoint var4 to a, variable, var4, apoint var4 to 4, variable, var4, 4point var4 to 5, variable, var4, 5point var4 to 10, variable, var4, 10point var4 to 234234, variable, var4, 234234point var4 to 343423424, variable, var4, 343423424point var4 to london, variable, var4, londonpoint var4 to opera, variable, var4, operapoint var4 to paul, variable, var4, paulpoint var4 to fancy, variable, var4, fancypoint var4 to 9, variable, var4, 9point var4 to 223, variable, var4, 223point size to 0, variable, size, 0point size to x, variable, size, xpoint size to wrferer, variable, size, wrfererpoint size to banana, variable, size, bananapoint size to const, variable, size, constpoint size to start, variable, size, startpoint size to end, variable, size, endpoint size to time, variable, size, timepoint size to size, variable, size, sizepoint size to a, variable, size, apoint size to 4, variable, size, 4point size to 5, variable, size, 5point size to 10, variable, size, 10point size to 234234, variable, size, 234234point size to 343423424, variable, size, 343423424point size to london, variable, size, londonpoint size to opera, variable, size, operapoint size to paul, variable, size, paulpoint size to fancy, variable, size, fancypoint size to 9, variable, size, 9point size to 223, variable, size, 223point i to 0, variable, i, 0point i to x, variable, i, xpoint i to wrferer, variable, i, wrfererpoint i to banana, variable, i, bananapoint i to const, variable, i, constpoint i to start, variable, i, startpoint i to end, variable, i, endpoint i to time, variable, i, timepoint i to size, variable, i, sizepoint i to a, variable, i, apoint i to 4, variable, i, 4point i to 5, variable, i, 5point i to 10, variable, i, 10point i to 234234, variable, i, 234234point i to 343423424, variable, i, 343423424point i to london, variable, i, londonpoint i to opera, variable, i, operapoint i to paul, variable, i, paulpoint i to fancy, variable, i, fancypoint i to 9, variable, i, 9point i to 223, variable, i, 223point j to 0, variable, j, 0point j to x, variable, j, xpoint j to wrferer, variable, j, wrfererpoint j to banana, variable, j, bananapoint j to const, variable, j, constpoint j to start, variable, j, startpoint j to end, variable, j, endpoint j to time, variable, j, timepoint j to size, variable, j, sizepoint j to a, variable, j, apoint j to 4, variable, j, 4point j to 5, variable, j, 5point j to 10, variable, j, 10point j to 234234, variable, j, 234234point j to 343423424, variable, j, 343423424point j to london, variable, j, londonpoint j to opera, variable, j, operapoint j to paul, variable, j, paulpoint j to fancy, variable, j, fancypoint j to 9, variable, j, 9point j to 223, variable, j, 223point a to 0, variable, a, 0point a to x, variable, a, xpoint a to wrferer, variable, a, wrfererpoint a to banana, variable, a, bananapoint a to const, variable, a, constpoint a to start, variable, a, startpoint a to end, variable, a, endpoint a to time, variable, a, timepoint a to size, variable, a, sizepoint a to a, variable, a, apoint a to 4, variable, a, 4point a to 5, variable, a, 5point a to 10, variable, a, 10point a to 234234, variable, a, 234234point a to 343423424, variable, a, 343423424point a to london, variable, a, londonpoint a to opera, variable, a, operapoint a to paul, variable, a, paulpoint a to fancy, variable, a, fancypoint a to 9, variable, a, 9point a to 223, variable, a, 223point weather_london to 0, variable, weather_london, 0point weather_london to x, variable, weather_london, xpoint weather_london to wrferer, variable, weather_london, wrfererpoint weather_london to banana, variable, weather_london, bananapoint weather_london to const, variable, weather_london, constpoint weather_london to start, variable, weather_london, startpoint weather_london to end, variable, weather_london, endpoint weather_london to time, variable, weather_london, timepoint weather_london to size, variable, weather_london, sizepoint weather_london to a, variable, weather_london, apoint weather_london to 4, variable, weather_london, 4point weather_london to 5, variable, weather_london, 5point weather_london to 10, variable, weather_london, 10point weather_london to 234234, variable, weather_london, 234234point weather_london to 343423424, variable, weather_london, 343423424point weather_london to london, variable, weather_london, londonpoint weather_london to opera, variable, weather_london, operapoint weather_london to paul, variable, weather_london, paulpoint weather_london to fancy, variable, weather_london, fancypoint weather_london to 9, variable, weather_london, 9point weather_london to 223, variable, weather_london, 223point int_5 to 0, variable, int_5, 0point int_5 to x, variable, int_5, xpoint int_5 to wrferer, variable, int_5, wrfererpoint int_5 to banana, variable, int_5, bananapoint int_5 to const, variable, int_5, constpoint int_5 to start, variable, int_5, startpoint int_5 to end, variable, int_5, endpoint int_5 to time, variable, int_5, timepoint int_5 to size, variable, int_5, sizepoint int_5 to a, variable, int_5, apoint int_5 to 4, variable, int_5, 4point int_5 to 5, variable, int_5, 5point int_5 to 10, variable, int_5, 10point int_5 to 234234, variable, int_5, 234234point int_5 to 343423424, variable, int_5, 343423424point int_5 to london, variable, int_5, londonpoint int_5 to opera, variable, int_5, operapoint int_5 to paul, variable, int_5, paulpoint int_5 to fancy, variable, int_5, fancypoint int_5 to 9, variable, int_5, 9point int_5 to 223, variable, int_5, 223point str to 0, variable, str, 0point str to x, variable, str, xpoint str to wrferer, variable, str, wrfererpoint str to banana, variable, str, bananapoint str to const, variable, str, constpoint str to start, variable, str, startpoint str to end, variable, str, endpoint str to time, variable, str, timepoint str to size, variable, str, sizepoint str to a, variable, str, apoint str to 4, variable, str, 4point str to 5, variable, str, 5point str to 10, variable, str, 10point str to 234234, variable, str, 234234point str to 343423424, variable, str, 343423424point str to london, variable, str, londonpoint str to opera, variable, str, operapoint str to paul, variable, str, paulpoint str to fancy, variable, str, fancypoint str to 9, variable, str, 9point str to 223, variable, str, 223point var to 0, variable, var, 0point var to x, variable, var, xpoint var to wrferer, variable, var, wrfererpoint var to banana, variable, var, bananapoint var to const, variable, var, constpoint var to start, variable, var, startpoint var to end, variable, var, endpoint var to time, variable, var, timepoint var to size, variable, var, sizepoint var to a, variable, var, apoint var to 4, variable, var, 4point var to 5, variable, var, 5point var to 10, variable, var, 10point var to 234234, variable, var, 234234point var to 343423424, variable, var, 343423424point var to london, variable, var, londonpoint var to opera, variable, var, operapoint var to paul, variable, var, paulpoint var to fancy, variable, var, fancypoint var to 9, variable, var, 9point var to 223, variable, var, 223turn x to 0, variable, x, 0turn x to x, variable, x, xturn x to wrferer, variable, x, wrfererturn x to banana, variable, x, bananaturn x to const, variable, x, constturn x to start, variable, x, startturn x to end, variable, x, endturn x to time, variable, x, timeturn x to size, variable, x, sizeturn x to a, variable, x, aturn x to 4, variable, x, 4turn x to 5, variable, x, 5turn x to 10, variable, x, 10turn x to 234234, variable, x, 234234turn x to 343423424, variable, x, 343423424turn x to london, variable, x, londonturn x to opera, variable, x, operaturn x to paul, variable, x, paulturn x to fancy, variable, x, fancyturn x to 9, variable, x, 9turn x to 223, variable, x, 223turn wrferer to 0, variable, wrferer, 0turn wrferer to x, variable, wrferer, xturn wrferer to wrferer, variable, wrferer, wrfererturn wrferer to banana, variable, wrferer, bananaturn wrferer to const, variable, wrferer, constturn wrferer to start, variable, wrferer, startturn wrferer to end, variable, wrferer, endturn wrferer to time, variable, wrferer, timeturn wrferer to size, variable, wrferer, sizeturn wrferer to a, variable, wrferer, aturn wrferer to 4, variable, wrferer, 4turn wrferer to 5, variable, wrferer, 5turn wrferer to 10, variable, wrferer, 10turn wrferer to 234234, variable, wrferer, 234234turn wrferer to 343423424, variable, wrferer, 343423424turn wrferer to london, variable, wrferer, londonturn wrferer to opera, variable, wrferer, operaturn wrferer to paul, variable, wrferer, paulturn wrferer to fancy, variable, wrferer, fancyturn wrferer to 9, variable, wrferer, 9turn wrferer to 223, variable, wrferer, 223turn banana to 0, variable, banana, 0turn banana to x, variable, banana, xturn banana to wrferer, variable, banana, wrfererturn banana to banana, variable, banana, bananaturn banana to const, variable, banana, constturn banana to start, variable, banana, startturn banana to end, variable, banana, endturn banana to time, variable, banana, timeturn banana to size, variable, banana, sizeturn banana to a, variable, banana, aturn banana to 4, variable, banana, 4turn banana to 5, variable, banana, 5turn banana to 10, variable, banana, 10turn banana to 234234, variable, banana, 234234turn banana to 343423424, variable, banana, 343423424turn banana to london, variable, banana, londonturn banana to opera, variable, banana, operaturn banana to paul, variable, banana, paulturn banana to fancy, variable, banana, fancyturn banana to 9, variable, banana, 9turn banana to 223, variable, banana, 223turn start to 0, variable, start, 0turn start to x, variable, start, xturn start to wrferer, variable, start, wrfererturn start to banana, variable, start, bananaturn start to const, variable, start, constturn start to start, variable, start, startturn start to end, variable, start, endturn start to time, variable, start, timeturn start to size, variable, start, sizeturn start to a, variable, start, aturn start to 4, variable, start, 4turn start to 5, variable, start, 5turn start to 10, variable, start, 10turn start to 234234, variable, start, 234234turn start to 343423424, variable, start, 343423424turn start to london, variable, start, londonturn start to opera, variable, start, operaturn start to paul, variable, start, paulturn start to fancy, variable, start, fancyturn start to 9, variable, start, 9turn start to 223, variable, start, 223turn time to 0, variable, time, 0turn time to x, variable, time, xturn time to wrferer, variable, time, wrfererturn time to banana, variable, time, bananaturn time to const, variable, time, constturn time to start, variable, time, startturn time to end, variable, time, endturn time to time, variable, time, timeturn time to size, variable, time, sizeturn time to a, variable, time, aturn time to 4, variable, time, 4turn time to 5, variable, time, 5turn time to 10, variable, time, 10turn time to 234234, variable, time, 234234turn time to 343423424, variable, time, 343423424turn time to london, variable, time, londonturn time to opera, variable, time, operaturn time to paul, variable, time, paulturn time to fancy, variable, time, fancyturn time to 9, variable, time, 9turn time to 223, variable, time, 223turn num to 0, variable, num, 0turn num to x, variable, num, xturn num to wrferer, variable, num, wrfererturn num to banana, variable, num, bananaturn num to const, variable, num, constturn num to start, variable, num, startturn num to end, variable, num, endturn num to time, variable, num, timeturn num to size, variable, num, sizeturn num to a, variable, num, aturn num to 4, variable, num, 4turn num to 5, variable, num, 5turn num to 10, variable, num, 10turn num to 234234, variable, num, 234234turn num to 343423424, variable, num, 343423424turn num to london, variable, num, londonturn num to opera, variable, num, operaturn num to paul, variable, num, paulturn num to fancy, variable, num, fancyturn num to 9, variable, num, 9turn num to 223, variable, num, 223turn var4 to 0, variable, var4, 0turn var4 to x, variable, var4, xturn var4 to wrferer, variable, var4, wrfererturn var4 to banana, variable, var4, bananaturn var4 to const, variable, var4, constturn var4 to start, variable, var4, startturn var4 to end, variable, var4, endturn var4 to time, variable, var4, timeturn var4 to size, variable, var4, sizeturn var4 to a, variable, var4, aturn var4 to 4, variable, var4, 4turn var4 to 5, variable, var4, 5turn var4 to 10, variable, var4, 10turn var4 to 234234, variable, var4, 234234turn var4 to 343423424, variable, var4, 343423424turn var4 to london, variable, var4, londonturn var4 to opera, variable, var4, operaturn var4 to paul, variable, var4, paulturn var4 to fancy, variable, var4, fancyturn var4 to 9, variable, var4, 9turn var4 to 223, variable, var4, 223turn size to 0, variable, size, 0turn size to x, variable, size, xturn size to wrferer, variable, size, wrfererturn size to banana, variable, size, bananaturn size to const, variable, size, constturn size to start, variable, size, startturn size to end, variable, size, endturn size to time, variable, size, timeturn size to size, variable, size, sizeturn size to a, variable, size, aturn size to 4, variable, size, 4turn size to 5, variable, size, 5turn size to 10, variable, size, 10turn size to 234234, variable, size, 234234turn size to 343423424, variable, size, 343423424turn size to london, variable, size, londonturn size to opera, variable, size, operaturn size to paul, variable, size, paulturn size to fancy, variable, size, fancyturn size to 9, variable, size, 9turn size to 223, variable, size, 223turn i to 0, variable, i, 0turn i to x, variable, i, xturn i to wrferer, variable, i, wrfererturn i to banana, variable, i, bananaturn i to const, variable, i, constturn i to start, variable, i, startturn i to end, variable, i, endturn i to time, variable, i, timeturn i to size, variable, i, sizeturn i to a, variable, i, aturn i to 4, variable, i, 4turn i to 5, variable, i, 5turn i to 10, variable, i, 10turn i to 234234, variable, i, 234234turn i to 343423424, variable, i, 343423424turn i to london, variable, i, londonturn i to opera, variable, i, operaturn i to paul, variable, i, paulturn i to fancy, variable, i, fancyturn i to 9, variable, i, 9turn i to 223, variable, i, 223turn j to 0, variable, j, 0turn j to x, variable, j, xturn j to wrferer, variable, j, wrfererturn j to banana, variable, j, bananaturn j to const, variable, j, constturn j to start, variable, j, startturn j to end, variable, j, endturn j to time, variable, j, timeturn j to size, variable, j, sizeturn j to a, variable, j, aturn j to 4, variable, j, 4turn j to 5, variable, j, 5turn j to 10, variable, j, 10turn j to 234234, variable, j, 234234turn j to 343423424, variable, j, 343423424turn j to london, variable, j, londonturn j to opera, variable, j, operaturn j to paul, variable, j, paulturn j to fancy, variable, j, fancyturn j to 9, variable, j, 9turn j to 223, variable, j, 223turn a to 0, variable, a, 0turn a to x, variable, a, xturn a to wrferer, variable, a, wrfererturn a to banana, variable, a, bananaturn a to const, variable, a, constturn a to start, variable, a, startturn a to end, variable, a, endturn a to time, variable, a, timeturn a to size, variable, a, sizeturn a to a, variable, a, aturn a to 4, variable, a, 4turn a to 5, variable, a, 5turn a to 10, variable, a, 10turn a to 234234, variable, a, 234234turn a to 343423424, variable, a, 343423424turn a to london, variable, a, londonturn a to opera, variable, a, operaturn a to paul, variable, a, paulturn a to fancy, variable, a, fancyturn a to 9, variable, a, 9turn a to 223, variable, a, 223turn weather_london to 0, variable, weather_london, 0turn weather_london to x, variable, weather_london, xturn weather_london to wrferer, variable, weather_london, wrfererturn weather_london to banana, variable, weather_london, bananaturn weather_london to const, variable, weather_london, constturn weather_london to start, variable, weather_london, startturn weather_london to end, variable, weather_london, endturn weather_london to time, variable, weather_london, timeturn weather_london to size, variable, weather_london, sizeturn weather_london to a, variable, weather_london, aturn weather_london to 4, variable, weather_london, 4turn weather_london to 5, variable, weather_london, 5turn weather_london to 10, variable, weather_london, 10turn weather_london to 234234, variable, weather_london, 234234turn weather_london to 343423424, variable, weather_london, 343423424turn weather_london to london, variable, weather_london, londonturn weather_london to opera, variable, weather_london, operaturn weather_london to paul, variable, weather_london, paulturn weather_london to fancy, variable, weather_london, fancyturn weather_london to 9, variable, weather_london, 9turn weather_london to 223, variable, weather_london, 223turn int_5 to 0, variable, int_5, 0turn int_5 to x, variable, int_5, xturn int_5 to wrferer, variable, int_5, wrfererturn int_5 to banana, variable, int_5, bananaturn int_5 to const, variable, int_5, constturn int_5 to start, variable, int_5, startturn int_5 to end, variable, int_5, endturn int_5 to time, variable, int_5, timeturn int_5 to size, variable, int_5, sizeturn int_5 to a, variable, int_5, aturn int_5 to 4, variable, int_5, 4turn int_5 to 5, variable, int_5, 5turn int_5 to 10, variable, int_5, 10turn int_5 to 234234, variable, int_5, 234234turn int_5 to 343423424, variable, int_5, 343423424turn int_5 to london, variable, int_5, londonturn int_5 to opera, variable, int_5, operaturn int_5 to paul, variable, int_5, paulturn int_5 to fancy, variable, int_5, fancyturn int_5 to 9, variable, int_5, 9turn int_5 to 223, variable, int_5, 223turn str to 0, variable, str, 0turn str to x, variable, str, xturn str to wrferer, variable, str, wrfererturn str to banana, variable, str, bananaturn str to const, variable, str, constturn str to start, variable, str, startturn str to end, variable, str, endturn str to time, variable, str, timeturn str to size, variable, str, sizeturn str to a, variable, str, aturn str to 4, variable, str, 4turn str to 5, variable, str, 5turn str to 10, variable, str, 10turn str to 234234, variable, str, 234234turn str to 343423424, variable, str, 343423424turn str to london, variable, str, londonturn str to opera, variable, str, operaturn str to paul, variable, str, paulturn str to fancy, variable, str, fancyturn str to 9, variable, str, 9turn str to 223, variable, str, 223turn var to 0, variable, var, 0turn var to x, variable, var, xturn var to wrferer, variable, var, wrfererturn var to banana, variable, var, bananaturn var to const, variable, var, constturn var to start, variable, var, startturn var to end, variable, var, endturn var to time, variable, var, timeturn var to size, variable, var, sizeturn var to a, variable, var, aturn var to 4, variable, var, 4turn var to 5, variable, var, 5turn var to 10, variable, var, 10turn var to 234234, variable, var, 234234turn var to 343423424, variable, var, 343423424turn var to london, variable, var, londonturn var to opera, variable, var, operaturn var to paul, variable, var, paulturn var to fancy, variable, var, fancyturn var to 9, variable, var, 9turn var to 223, variable, var, 223set x to 0, variable, x, 0set x to x, variable, x, xset x to wrferer, variable, x, wrfererset x to banana, variable, x, bananaset x to const, variable, x, constset x to start, variable, x, startset x to end, variable, x, endset x to time, variable, x, timeset x to size, variable, x, sizeset x to a, variable, x, aset x to 4, variable, x, 4set x to 5, variable, x, 5set x to 10, variable, x, 10set x to 234234, variable, x, 234234set x to 343423424, variable, x, 343423424set x to london, variable, x, london